"DESCRIPTION","DURATION IN MS","NAME","PARENT SUITE","START TIME","STATUS","STOP TIME","SUB SUITE","SUITE","TEST CLASS","TEST METHOD"
"","11510","Create Ever/Always/Never Flag by browsing measure type categories","chromium","Fri Mar 06 13:44:49 UTC 2026","passed","Fri Mar 06 13:45:01 UTC 2026","","measures/ever-always-never.spec.ts","",""
"","15001","Should allow specifying the timeperiod information","chromium","Fri Mar 06 13:46:05 UTC 2026","passed","Fri Mar 06 13:46:20 UTC 2026","","measures/time-categorization.spec.ts","",""
"","48382","Should be able to execute an event exploration for a specific cohort","chromium","Fri Mar 06 13:43:46 UTC 2026","passed","Fri Mar 06 13:44:35 UTC 2026","","measures/common/event-exploration.spec.ts","",""
"","11091","Select entry criteria dates relative to parent cohort","chromium","Fri Mar 06 13:41:57 UTC 2026","passed","Fri Mar 06 13:42:08 UTC 2026","","cohort-definitions/common/cohort-definitions-entry-date.spec.ts","",""
"","152568","Should allow configuration and execution of Descriptive Analysis","chromium","Fri Mar 06 13:38:31 UTC 2026","passed","Fri Mar 06 13:41:03 UTC 2026","","analysis/analysis-descriptive.spec.ts","",""
"","16378","Generated Comparative Cohort should have correct criteria in read-only mode","chromium","Fri Mar 06 13:42:32 UTC 2026","passed","Fri Mar 06 13:42:48 UTC 2026","","cohorts/cohorts-comparative.spec.ts","",""
"","18741","Duplicate/Edit/Lock/Archive/Delete measures from Measure Library","chromium","Fri Mar 06 13:43:12 UTC 2026","passed","Fri Mar 06 13:43:31 UTC 2026","","lists/measures-list.spec.ts","",""
"","10448","Should be able to create a comparative cohort from an external source","chromium","Fri Mar 06 13:41:45 UTC 2026","passed","Fri Mar 06 13:41:55 UTC 2026","","cohort-definitions/cohort-definitions-external-comparative.spec.ts","",""
"","11263","Generated Comparative Cohort can be used in an analysis plan","chromium","Fri Mar 06 13:42:32 UTC 2026","passed","Fri Mar 06 13:42:43 UTC 2026","","cohorts/cohorts-comparative.spec.ts","",""
"","25646","Configure recategorization measure to recategorize input values","chromium","Fri Mar 06 13:45:14 UTC 2026","passed","Fri Mar 06 13:45:39 UTC 2026","","measures/recategorization.spec.ts","",""
"","78450","Generate Comparative Cohort (MARKETSCAN_TINY_ADM)","base-cohorts","Fri Mar 06 13:34:05 UTC 2026","passed","Fri Mar 06 13:35:23 UTC 2026","","setup/base-cohorts/base-comparative.setup.ts","",""
"","14165","Should allow setting of days for custom lag","chromium","Fri Mar 06 13:46:03 UTC 2026","passed","Fri Mar 06 13:46:17 UTC 2026","","measures/start-end-flag.spec.ts","",""
"","5626","Add and configure an Outcome","chromium","Fri Mar 06 13:40:25 UTC 2026","skipped","Fri Mar 06 13:40:31 UTC 2026","","analysis/analysis-self-controlled-risk.spec.ts","",""
"","22275","Verify results actions","chromium","Fri Mar 06 13:46:40 UTC 2026","passed","Fri Mar 06 13:47:03 UTC 2026","","results/results.spec.ts","",""
"","31437","Import exclusion criteria from another cohort and batch edit it","chromium","Fri Mar 06 13:42:25 UTC 2026","passed","Fri Mar 06 13:42:57 UTC 2026","","cohort-definitions/common/cohort-definitions-import-exclusion-criteria.spec.ts","",""
"","13300","should allow the target date to be set to the year","chromium","Fri Mar 06 13:44:05 UTC 2026","passed","Fri Mar 06 13:44:18 UTC 2026","","measures/cost-inflation-adjusted.spec.ts","",""
"","13335","Create a complete board","chromium","Fri Mar 06 13:41:11 UTC 2026","passed","Fri Mar 06 13:41:25 UTC 2026","","boards/board.spec.ts","",""
"","12621","Should be able to set Output to select flag values or categorical values","chromium","Fri Mar 06 13:45:01 UTC 2026","passed","Fri Mar 06 13:45:13 UTC 2026","","measures/lines-of-therapy.spec.ts","",""
"","75549","Generate Descriptive Cohort (Patients) (MARKETSCAN_TINY_ADM)","base-cohorts","Fri Mar 06 13:34:05 UTC 2026","passed","Fri Mar 06 13:35:20 UTC 2026","","setup/base-cohorts/base-descriptive.setup.ts","",""
"","14415","Should create an incomplete comparative cohort definition","chromium","Fri Mar 06 13:41:29 UTC 2026","passed","Fri Mar 06 13:41:43 UTC 2026","","cohort-definitions/cohort-definitions-comparative.spec.ts","",""
"","8761","Should display page not found dialog","chromium","Fri Mar 06 13:38:12 UTC 2026","passed","Fri Mar 06 13:38:21 UTC 2026","","404.spec.ts","",""
"","77853","Create and execute Self-Controlled Case Series Analysis Plan","chromium","Fri Mar 06 13:39:47 UTC 2026","passed","Fri Mar 06 13:41:05 UTC 2026","","analysis/analysis-self-controlled-case.spec.ts","",""
"","26175","Configure recategorization measure to generate flag values (dichotomization)","chromium","Fri Mar 06 13:45:13 UTC 2026","passed","Fri Mar 06 13:45:39 UTC 2026","","measures/recategorization.spec.ts","",""
"","11352","Should be able to create a Category Change Flag measure","chromium","Fri Mar 06 13:43:31 UTC 2026","passed","Fri Mar 06 13:43:42 UTC 2026","","measures/category-change-flag.spec.ts","",""
"","11725","Should define descriptive cohort entry criterion","chromium","Fri Mar 06 13:41:41 UTC 2026","passed","Fri Mar 06 13:41:53 UTC 2026","","cohort-definitions/cohort-definitions-descriptive.spec.ts","",""
"","17387","Create, edit and delete a user","chromium","Fri Mar 06 13:38:13 UTC 2026","passed","Fri Mar 06 13:38:30 UTC 2026","","account/user-management.spec.ts","",""
"","14580","Create recategorization measure by browsing measure type categories","chromium","Fri Mar 06 13:45:12 UTC 2026","passed","Fri Mar 06 13:45:27 UTC 2026","","measures/recategorization.spec.ts","",""
"","25590","Should add full results and plots to a when creating report","chromium","Fri Mar 06 13:46:13 UTC 2026","passed","Fri Mar 06 13:46:39 UTC 2026","","reports/reports.spec.ts","",""
"","41487","Verifies Standard global role permissions","chromium","Fri Mar 06 13:38:13 UTC 2026","passed","Fri Mar 06 13:38:54 UTC 2026","","account/permissioning.spec.ts","",""
"","0","Should calculate attrition table","chromium","Fri Mar 06 13:42:32 UTC 2026","skipped","Fri Mar 06 13:42:32 UTC 2026","","cohort-definitions/common/cohort-definitions-preview.spec.ts","",""
"","38375","Validate Patient Timeline Exploration results","chromium","Fri Mar 06 13:41:19 UTC 2026","passed","Fri Mar 06 13:41:57 UTC 2026","","analysis/explorations/patient-timeline.spec.ts","",""
"","188360","Should allow configuration and execution of Adherence Comparison Analysis","chromium","Fri Mar 06 13:38:13 UTC 2026","passed","Fri Mar 06 13:41:21 UTC 2026","","analysis/analysis-adherence-comparison.spec.ts","",""
"","18956","Should add exclusion criteria groups","chromium","Fri Mar 06 13:42:13 UTC 2026","passed","Fri Mar 06 13:42:32 UTC 2026","","cohort-definitions/common/cohort-definitions-exclusions.spec.ts","",""
"","12508","Should create a Lines of Therapy Measure browsing the categories","chromium","Fri Mar 06 13:44:58 UTC 2026","passed","Fri Mar 06 13:45:10 UTC 2026","","measures/lines-of-therapy.spec.ts","",""
"","17044","Should be able to select multiple cohorts and execute for each","chromium","Fri Mar 06 13:38:29 UTC 2026","passed","Fri Mar 06 13:38:46 UTC 2026","","analysis/analysis-comparative-safety.spec.ts","",""
"","14705","Should create a drug-coverage measure and allow full configuration","chromium","Fri Mar 06 13:44:21 UTC 2026","passed","Fri Mar 06 13:44:36 UTC 2026","","measures/drug-coverage.spec.ts","",""
"","12335","Should be able to sign out successfully when signing out","chromium","Fri Mar 06 13:42:48 UTC 2026","passed","Fri Mar 06 13:43:00 UTC 2026","","homepage.spec.ts","",""
"","12842","Should view a locked analysis plan","chromium","Fri Mar 06 13:46:36 UTC 2026","passed","Fri Mar 06 13:46:49 UTC 2026","","results/results-list.spec.ts","",""
"","16860","Create incomplete Adherence Description Analysis Plan","chromium","Fri Mar 06 13:38:13 UTC 2026","passed","Fri Mar 06 13:38:30 UTC 2026","","analysis/analysis-adherence-description.spec.ts","",""
"","20037","Should have combine options for attributes with Flag values","chromium","Fri Mar 06 13:44:48 UTC 2026","passed","Fri Mar 06 13:45:08 UTC 2026","","measures/event-value.spec.ts","",""
"","14427","Should generate a Start/End Flag measure","chromium","Fri Mar 06 13:46:01 UTC 2026","passed","Fri Mar 06 13:46:16 UTC 2026","","measures/start-end-flag.spec.ts","",""
"","12866","Creates a Population Exploration v1 with custom defined population from measure and exclusion criteria","chromium","Fri Mar 06 13:41:04 UTC 2026","passed","Fri Mar 06 13:41:17 UTC 2026","","analysis/explorations/pop-explorer-v1.spec.ts","",""
"","11764","Add and configure Demographics","chromium","Fri Mar 06 13:39:14 UTC 2026","passed","Fri Mar 06 13:39:25 UTC 2026","","analysis/analysis-prevalence.spec.ts","",""
"","14313","Configure Count Measure definition.","chromium","Fri Mar 06 13:44:18 UTC 2026","passed","Fri Mar 06 13:44:32 UTC 2026","","measures/count.spec.ts","",""
"","16894","Should allow to replace and remove measures","chromium","Fri Mar 06 13:46:01 UTC 2026","passed","Fri Mar 06 13:46:18 UTC 2026","","measures/sequence-basic.spec.ts","",""
"","13655","Should create a drug-supply measure and allow full configuration","chromium","Fri Mar 06 13:44:23 UTC 2026","passed","Fri Mar 06 13:44:37 UTC 2026","","measures/drug-supply.spec.ts","",""
"","77969","Configure a Comparative (From Subgroup) Cohort Definition and generate a cohort","chromium","Fri Mar 06 13:41:53 UTC 2026","passed","Fri Mar 06 13:43:11 UTC 2026","","cohort-definitions/cohort-definitions-from-subgroups.spec.ts","",""
"","13371","Should select results to display","chromium","Fri Mar 06 13:46:38 UTC 2026","passed","Fri Mar 06 13:46:51 UTC 2026","","results/results.spec.ts","",""
"","28982","AI assistant","chromium","Fri Mar 06 13:41:16 UTC 2026","passed","Fri Mar 06 13:41:44 UTC 2026","","chatbot/ai-assistant.spec.ts","",""
"","21080","Should re-order exclusion criteria","chromium","Fri Mar 06 13:42:08 UTC 2026","passed","Fri Mar 06 13:42:29 UTC 2026","","cohort-definitions/common/cohort-definitions-exclusions.spec.ts","",""
"","15713","Add and configure Conditions of Interest","chromium","Fri Mar 06 13:39:26 UTC 2026","passed","Fri Mar 06 13:39:41 UTC 2026","","analysis/analysis-prevalence.spec.ts","",""
"","12014","Should be able to set the source measure for a Category Change Flag measure","chromium","Fri Mar 06 13:43:33 UTC 2026","passed","Fri Mar 06 13:43:45 UTC 2026","","measures/category-change-flag.spec.ts","",""
"","12055","Should create event combination measure by browsing measure type categories","chromium","Fri Mar 06 13:44:37 UTC 2026","passed","Fri Mar 06 13:44:49 UTC 2026","","measures/event-combination.spec.ts","",""
"","10855","Should not allow sampled cohort to be used as parent cohort","chromium","Fri Mar 06 13:41:43 UTC 2026","passed","Fri Mar 06 13:41:54 UTC 2026","","cohort-definitions/cohort-definitions-descriptive.spec.ts","",""
"","10936","Should switch results list tabs","chromium","Fri Mar 06 13:46:36 UTC 2026","passed","Fri Mar 06 13:46:47 UTC 2026","","results/results-list.spec.ts","",""
"","13517","Should configure a cohort parent","chromium","Fri Mar 06 13:42:29 UTC 2026","passed","Fri Mar 06 13:42:43 UTC 2026","","cohort-definitions/common/cohort-definitions-parent.spec.ts","",""
"","18856","Should create a Lines of Therapy Measure, add a drug group and save","chromium","Fri Mar 06 13:44:58 UTC 2026","passed","Fri Mar 06 13:45:16 UTC 2026","","measures/lines-of-therapy.spec.ts","",""
"","68492","Should generate measure preview counts","chromium","Fri Mar 06 13:43:56 UTC 2026","passed","Fri Mar 06 13:45:04 UTC 2026","","measures/common/preview-counts.spec.ts","",""
"","49245","Configure descriptive statistics and analyze measure","chromium","Fri Mar 06 13:43:46 UTC 2026","passed","Fri Mar 06 13:44:36 UTC 2026","","measures/common/measure-analyzer.spec.ts","",""
"","6426","Import code list template file","chromium","Fri Mar 06 13:42:56 UTC 2026","passed","Fri Mar 06 13:43:03 UTC 2026","","lists/code-list-library.spec.ts","",""
"","13516","Should persist a basic descriptive cohort definition","chromium","Fri Mar 06 13:41:40 UTC 2026","passed","Fri Mar 06 13:41:53 UTC 2026","","cohort-definitions/cohort-definitions-descriptive.spec.ts","",""
"","19656","Should create a numeric categorization measure and allow dichotomizing configuration","chromium","Fri Mar 06 13:45:09 UTC 2026","passed","Fri Mar 06 13:45:28 UTC 2026","","measures/numeric-categorization.spec.ts","",""
"","12152","View Info and Download Event Codes of the Event Filter measure","chromium","Fri Mar 06 13:43:14 UTC 2026","passed","Fri Mar 06 13:43:26 UTC 2026","","lists/measures-list.spec.ts","",""
"","17944","Verify analytic cohort file immutable actions","chromium","Fri Mar 06 13:46:18 UTC 2026","passed","Fri Mar 06 13:46:36 UTC 2026","","results/analytic-cohort-files.spec.ts","",""
"","13958","Create adherence measure by search","chromium","Fri Mar 06 13:43:16 UTC 2026","passed","Fri Mar 06 13:43:30 UTC 2026","","measures/adherence.spec.ts","",""
"","17370","Show 1 additional day options when ""AT_MOST"" is selected","chromium","Fri Mar 06 13:45:43 UTC 2026","passed","Fri Mar 06 13:46:01 UTC 2026","","measures/sequence-advanced.spec.ts","",""
"","16106","Should add-all/remove-all found codes","chromium","Fri Mar 06 13:43:41 UTC 2026","passed","Fri Mar 06 13:43:57 UTC 2026","","measures/code-search.spec.ts","",""
"","7772","Should visit support page when click on support work with aetion link","chromium","Fri Mar 06 13:42:48 UTC 2026","passed","Fri Mar 06 13:42:56 UTC 2026","","homepage.spec.ts","",""
"","19133","Should allow the removing and replacing of a source measure","chromium","Fri Mar 06 13:45:27 UTC 2026","passed","Fri Mar 06 13:45:46 UTC 2026","","measures/recurrence.spec.ts","",""
"","13509","Should perform the advanced list search","chromium","Fri Mar 06 13:43:42 UTC 2026","passed","Fri Mar 06 13:43:56 UTC 2026","","measures/code-search.spec.ts","",""
"","6334","Check if correct list request is triggered when switching between cohort and cohort def libraries","chromium","Fri Mar 06 13:43:11 UTC 2026","passed","Fri Mar 06 13:43:17 UTC 2026","","lists/lists-reloading.spec.ts","",""
"","15409","Generate measure from code list","chromium","Fri Mar 06 13:42:58 UTC 2026","passed","Fri Mar 06 13:43:14 UTC 2026","","lists/code-list-library.spec.ts","",""
"","11989","Should be able to create a continuous episodes measure by browsing categories","chromium","Fri Mar 06 13:43:57 UTC 2026","passed","Fri Mar 06 13:44:09 UTC 2026","","measures/continuous-episodes.spec.ts","",""
"","150121","Should execute Comparative Safety analysis and validate the results","chromium","Fri Mar 06 13:38:30 UTC 2026","passed","Fri Mar 06 13:41:00 UTC 2026","","analysis/analysis-comparative-safety.spec.ts","",""
"","13856","Should allow configuration of trends in statistical plan","chromium","Fri Mar 06 13:38:30 UTC 2026","passed","Fri Mar 06 13:38:44 UTC 2026","","analysis/analysis-descriptive.spec.ts","",""
"","16607","Import patient characteristics","chromium","Fri Mar 06 13:40:42 UTC 2026","passed","Fri Mar 06 13:40:59 UTC 2026","","analysis/analysis-self-controlled-risk.spec.ts","",""
"","84139","Should create descriptive cohort with sampling and verify all sampling features","chromium","Fri Mar 06 13:42:33 UTC 2026","passed","Fri Mar 06 13:43:57 UTC 2026","","cohorts/cohorts-descriptive.spec.ts","",""
"","80906","Create/execute/rename/move/delete a Associations Analysis Plan","chromium","Fri Mar 06 13:38:13 UTC 2026","passed","Fri Mar 06 13:39:33 UTC 2026","","analysis/analysis-associations.spec.ts","",""
"","139127","Should allow configuration and execution of persistence description analysis","chromium","Fri Mar 06 13:39:10 UTC 2026","passed","Fri Mar 06 13:41:29 UTC 2026","","analysis/analysis-persistence-description.spec.ts","",""
"","7055","Should create an empty project","base-project","Fri Mar 06 13:33:11 UTC 2026","passed","Fri Mar 06 13:33:18 UTC 2026","","setup/base-project.setup.ts","",""
"","14583","Create score measure by search","chromium","Fri Mar 06 13:45:28 UTC 2026","passed","Fri Mar 06 13:45:43 UTC 2026","","measures/score.spec.ts","",""
"","9956","Should not show COUNT_EVENTS and COUNT_TRUE aggregations for patient characteristics","chromium","Fri Mar 06 13:39:00 UTC 2026","passed","Fri Mar 06 13:39:10 UTC 2026","","analysis/analysis-forecasting.spec.ts","",""
"","15242","Show 2 additional day options when ""BETWEEN"" is selected","chromium","Fri Mar 06 13:45:48 UTC 2026","passed","Fri Mar 06 13:46:03 UTC 2026","","measures/sequence-advanced.spec.ts","",""
"","18338","Configure Drug Treatment Pattern measure definition","chromium","Fri Mar 06 13:44:23 UTC 2026","passed","Fri Mar 06 13:44:42 UTC 2026","","measures/drug-treatment-pattern.spec.ts","",""
"","13145","Should update Frequency page when in-use outcome is deleted on the Outcomes and Comorbidities page","chromium","Fri Mar 06 13:38:55 UTC 2026","passed","Fri Mar 06 13:39:08 UTC 2026","","analysis/analysis-forecasting.spec.ts","",""
"","21040","Should create an event overlap measure and allow full configuration","chromium","Fri Mar 06 13:44:44 UTC 2026","passed","Fri Mar 06 13:45:05 UTC 2026","","measures/event-overlap.spec.ts","",""
"","9548","Create, browse, edit and delete a code list","chromium","Fri Mar 06 13:42:55 UTC 2026","passed","Fri Mar 06 13:43:05 UTC 2026","","lists/code-list-library.spec.ts","",""
"","5427","Should see the copyright information on the homepage when signed in.","chromium","Fri Mar 06 13:42:43 UTC 2026","passed","Fri Mar 06 13:42:48 UTC 2026","","homepage.spec.ts","",""
"","144931","Should display sampling chip when using sampled cohort in analysis","chromium","Fri Mar 06 13:38:39 UTC 2026","passed","Fri Mar 06 13:41:04 UTC 2026","","analysis/analysis-descriptive.spec.ts","",""
"","9580","Should filter out all measure types","chromium","Fri Mar 06 13:45:04 UTC 2026","passed","Fri Mar 06 13:45:14 UTC 2026","","measures/measure-types.spec.ts","",""
"","14664","Should be abe to create a continuous episodes measure","chromium","Fri Mar 06 13:43:57 UTC 2026","passed","Fri Mar 06 13:44:12 UTC 2026","","measures/continuous-episodes.spec.ts","",""
"","19552","Should have default order","chromium","Fri Mar 06 13:46:16 UTC 2026","passed","Fri Mar 06 13:46:35 UTC 2026","","reports/reports.spec.ts","",""
"","10438","Configure all analysis plan options","chromium","Fri Mar 06 13:40:46 UTC 2026","passed","Fri Mar 06 13:40:56 UTC 2026","","analysis/analysis-self-controlled-risk.spec.ts","",""
"","118410","Should allow to analyze to view descriptive statistics","chromium","Fri Mar 06 13:46:11 UTC 2026","passed","Fri Mar 06 13:48:09 UTC 2026","","measures/time-categorization.spec.ts","",""
"","18128","Select entry criteria dates in Comparative Cohort (Time 0 Sampled Comparator)","chromium","Fri Mar 06 13:41:56 UTC 2026","passed","Fri Mar 06 13:42:14 UTC 2026","","cohort-definitions/common/cohort-definitions-entry-date.spec.ts","",""
"","74058","Run Prevalence and Incidence Analysis and validate results","chromium","Fri Mar 06 13:39:11 UTC 2026","passed","Fri Mar 06 13:40:25 UTC 2026","","analysis/analysis-prevalence.spec.ts","",""
"","76891","Creates and executes a Population Exploration v1 with custom defined population and characteristics from codes, and validates results","chromium","Fri Mar 06 13:41:03 UTC 2026","passed","Fri Mar 06 13:42:20 UTC 2026","","analysis/explorations/pop-explorer-v1.spec.ts","",""
"","15225","Duplicate/Edit/Lock/Archive/Delete cohort definitions from Library","chromium","Fri Mar 06 13:43:00 UTC 2026","passed","Fri Mar 06 13:43:16 UTC 2026","","lists/cohort-definitions-list.spec.ts","",""
"","20222","Create/duplicate/archive/filter projects","chromium","Fri Mar 06 13:46:11 UTC 2026","passed","Fri Mar 06 13:46:32 UTC 2026","","projects/project.spec.ts","",""
"","12227","should allow the component to be deleted","chromium","Fri Mar 06 13:44:09 UTC 2026","passed","Fri Mar 06 13:44:22 UTC 2026","","measures/cost-inflation-adjusted.spec.ts","",""
"","19187","Should be able to update maggot timewindows and ensure preservation when duplicated","chromium","Fri Mar 06 13:42:14 UTC 2026","passed","Fri Mar 06 13:42:33 UTC 2026","","cohort-definitions/common/cohort-definitions-exclusions.spec.ts","",""
"","18826","Further restrict cohort entry dates with parent cohort","chromium","Fri Mar 06 13:42:07 UTC 2026","passed","Fri Mar 06 13:42:25 UTC 2026","","cohort-definitions/common/cohort-definitions-entry-date.spec.ts","",""
"","16577","Add a time relation","chromium","Fri Mar 06 13:45:48 UTC 2026","passed","Fri Mar 06 13:46:05 UTC 2026","","measures/sequence-advanced.spec.ts","",""
"","27957","Move measures between project and library","chromium","Fri Mar 06 13:43:15 UTC 2026","passed","Fri Mar 06 13:43:43 UTC 2026","","lists/measures-list.spec.ts","",""
"","11166","Creates Any medical claim base measure","base-measures-1","Fri Mar 06 13:33:20 UTC 2026","passed","Fri Mar 06 13:33:31 UTC 2026","","setup/base-measures/1/event-filter-measures.setup.ts","",""
"","16817","Creates recategorization female base measure","base-measures-1","Fri Mar 06 13:33:20 UTC 2026","passed","Fri Mar 06 13:33:36 UTC 2026","","setup/base-measures/1/base-recategorization.setup.ts","",""
"","10688","Should create report folder","chromium","Fri Mar 06 13:46:12 UTC 2026","passed","Fri Mar 06 13:46:22 UTC 2026","","reports/reports.spec.ts","",""
"","25945","Should create duration modification measure with event duration, constant, and custom calculation types","chromium","Fri Mar 06 13:44:32 UTC 2026","passed","Fri Mar 06 13:44:57 UTC 2026","","measures/duration-modification.spec.ts","",""
"","12386","Should create/explore/delete a results folder","chromium","Fri Mar 06 13:46:35 UTC 2026","passed","Fri Mar 06 13:46:47 UTC 2026","","results/results-list.spec.ts","",""
"","82880","Create and execute a drug pathways exploration and validate/download results","chromium","Fri Mar 06 13:40:56 UTC 2026","passed","Fri Mar 06 13:42:19 UTC 2026","","analysis/explorations/drug-pathways.spec.ts","",""
"","51504","Verifies Read Only global role permissions","chromium","Fri Mar 06 13:38:13 UTC 2026","passed","Fri Mar 06 13:39:04 UTC 2026","","account/permissioning.spec.ts","",""
"","17603","Create/Rename/Duplicate/Import/Export/Delete Measure Library Folders","chromium","Fri Mar 06 13:43:15 UTC 2026","passed","Fri Mar 06 13:43:33 UTC 2026","","lists/measures-list.spec.ts","",""
"","22874","Create a valid Ever/Always/Never Flag measure by search","chromium","Fri Mar 06 13:44:49 UTC 2026","passed","Fri Mar 06 13:45:12 UTC 2026","","measures/ever-always-never.spec.ts","",""
"","149441","Should be able to view, manage and download Comparative Effectiveness Analysis results","chromium","Fri Mar 06 13:38:12 UTC 2026","passed","Fri Mar 06 13:40:42 UTC 2026","","analysis/analysis-comparative-effectiveness.spec.ts","",""
"","15601","Creates recategorization male base measure","base-measures-1","Fri Mar 06 13:33:20 UTC 2026","passed","Fri Mar 06 13:33:35 UTC 2026","","setup/base-measures/1/base-recategorization.setup.ts","",""
"","12793","should allow the component to be replaced","chromium","Fri Mar 06 13:44:09 UTC 2026","passed","Fri Mar 06 13:44:21 UTC 2026","","measures/cost-inflation-adjusted.spec.ts","",""
"","10770","Create a basic board","chromium","Fri Mar 06 13:41:05 UTC 2026","passed","Fri Mar 06 13:41:15 UTC 2026","","boards/board.spec.ts","",""
"","12894","Should be able to add and delete attributes on the Cross-Tabs tab","chromium","Fri Mar 06 13:43:43 UTC 2026","passed","Fri Mar 06 13:43:56 UTC 2026","","measures/common/event-exploration.spec.ts","",""
"","5794","Should return to homepage using topnav home","chromium","Fri Mar 06 13:42:46 UTC 2026","passed","Fri Mar 06 13:42:52 UTC 2026","","homepage.spec.ts","",""
"","13449","Create adherence measure using Drug Computation measure with multiple drug groups for evaluation","base-measures-3","Fri Mar 06 13:33:50 UTC 2026","passed","Fri Mar 06 13:34:03 UTC 2026","","setup/base-measures/3/adherence-measure.setup.ts","",""
"","109744","Execute a Meta-Analysis Plan","chromium","Fri Mar 06 13:39:08 UTC 2026","passed","Fri Mar 06 13:40:57 UTC 2026","","analysis/analysis-meta.spec.ts","",""
"","16235","Should allow setting the Start/End Flag options","chromium","Fri Mar 06 13:46:03 UTC 2026","passed","Fri Mar 06 13:46:19 UTC 2026","","measures/start-end-flag.spec.ts","",""
"","10026","Should be able to create a descriptive cohort from an external source","chromium","Fri Mar 06 13:41:47 UTC 2026","passed","Fri Mar 06 13:41:57 UTC 2026","","cohort-definitions/cohort-definitions-external-descriptive.spec.ts","",""
"","16640","Show 1 additional day options when ""EXACTLY"" is selected","chromium","Fri Mar 06 13:45:46 UTC 2026","passed","Fri Mar 06 13:46:03 UTC 2026","","measures/sequence-advanced.spec.ts","",""
"","9425","authenticate","auth","Fri Mar 06 13:33:00 UTC 2026","passed","Fri Mar 06 13:33:09 UTC 2026","","setup/auth.setup.ts","",""
"","14240","Should persist an incomplete comparative time cohort definition","chromium","Fri Mar 06 13:41:17 UTC 2026","passed","Fri Mar 06 13:41:31 UTC 2026","","cohort-definitions/cohort-definitions-comparative-time.spec.ts","",""
"","20633","Should modify exclusion criteria - Descriptive Cohort (Person-Time)","chromium","Fri Mar 06 13:42:19 UTC 2026","passed","Fri Mar 06 13:42:40 UTC 2026","","cohort-definitions/common/cohort-definitions-exclusions.spec.ts","",""
"","13121","Should update cohort enrollment measure","chromium","Fri Mar 06 13:41:53 UTC 2026","passed","Fri Mar 06 13:42:07 UTC 2026","","cohort-definitions/common/cohort-definitions-enrollment.spec.ts","",""
"","17609","Add multiple sequences","chromium","Fri Mar 06 13:45:30 UTC 2026","passed","Fri Mar 06 13:45:48 UTC 2026","","measures/sequence-advanced.spec.ts","",""
